,Actors,Awards,BoxOffice,Country,DVD,Director,Genre,Language,Metascore,Plot,Poster,Production,Rated,Released,Response,Runtime,Title,Type,Website,Writer,Year,imdbID,imdbRating,imdbVotes,tomatoImage,tomatoReviews
0,"Naomi Watts, Martin Henderson, David Dorfman, Brian Cox",14 wins & 11 nominations.,"$128,579,698.00","USA, Japan",04 Mar 2003,Gore Verbinski,"Horror, Mystery",English,57,A journalist must investigate a mysterious videotape which seems to cause the death of anyone in a week of viewing it.,https://images-na.ssl-images-amazon.com/images/M/MV5BNDA2NTg2NjE4Ml5BMl5BanBnXkFtZTYwMjYxMDg5._V1_SX300.jpg,DreamWorks SKG,PG-13,18 Oct 2002,True,115 min,The Ring,movie,http://www.ring-themovie.com,"Ehren Kruger (screenplay), Kôji Suzuki (novel)",2002,tt0298130,7.1,"262,733",fresh,202
1,"Leonardo DiCaprio, Tom Hanks, Christopher Walken, Martin Sheen",Nominated for 2 Oscars. Another 12 wins & 39 nominations.,"$164,400,000.00","USA, Canada",06 May 2003,Steven Spielberg,"Biography, Crime, Drama","English, French",76,"The true story of Frank Abagnale Jr. who, before his 19th birthday, successfully conned millions of dollars' worth of checks as a Pan Am pilot, doctor, and legal prosecutor.",https://images-na.ssl-images-amazon.com/images/M/MV5BMTY5MzYzNjc5NV5BMl5BanBnXkFtZTYwNTUyNTc2._V1_SX300.jpg,DreamWorks SKG,PG-13,25 Dec 2002,True,141 min,Catch Me If You Can,movie,http://www.dreamworks.com/catchthem/jump2.html,"Jeff Nathanson (screenplay), Frank Abagnale Jr. (book), Stan Redding (book)",2002,tt0264464,8.0,"564,278",certified,195
2,"Leonardo DiCaprio, Daniel Day-Lewis, Cameron Diaz, Jim Broadbent",Nominated for 10 Oscars. Another 49 wins & 118 nominations.,"$77,605,296.00","USA, Italy",01 Jul 2003,Martin Scorsese,"Crime, Drama","English, Irish, Chinese, Latin",72,"In 1863, Amsterdam Vallon returns to the Five Points area of New York City seeking revenge against Bill the Butcher, his father's killer.",https://images-na.ssl-images-amazon.com/images/M/MV5BMTI4NTM0Mzg2NV5BMl5BanBnXkFtZTcwNjQxMDAwMQ@@._V1_SX300.jpg,Miramax Films,R,20 Dec 2002,True,167 min,Gangs of New York,movie,http://www.gangsofnewyork.com/,"Jay Cocks (story), Jay Cocks (screenplay), Steven Zaillian (screenplay), Kenneth Lonergan (screenplay)",2002,tt0217505,7.5,"327,657",certified,202
3,"Tyler Hoechlin, Rob Maxey, Liam Aiken, Jennifer Jason Leigh",Won 1 Oscar. Another 21 wins & 76 nominations.,"$104,054,514.00",USA,25 Feb 2003,Sam Mendes,"Crime, Drama, Thriller",English,72,Bonds of loyalty are put to the test when a hitman's son witnesses what his father does for a living.,https://images-na.ssl-images-amazon.com/images/M/MV5BMjA0MDM4ODM0Ml5BMl5BanBnXkFtZTYwNDE3MjU3._V1_SX300.jpg,DreamWorks SKG,R,12 Jul 2002,True,117 min,Road to Perdition,movie,http://www.roadtoperdition.com/,"Max Allan Collins (graphic novel), Richard Piers Rayner (graphic novel), David Self (screenplay)",2002,tt0257044,7.7,"206,372",certified,211
4,"Tobey Maguire, Willem Dafoe, Kirsten Dunst, James Franco",Nominated for 2 Oscars. Another 14 wins & 56 nominations.,"$403,706,375.00",USA,01 Nov 2002,Sam Raimi,"Action, Adventure",English,73,"When bitten by a genetically modified spider, a nerdy, shy, and awkward high school student gains spider-like abilities that he eventually must use to fight evil as a superhero after tragedy befalls his family.",https://images-na.ssl-images-amazon.com/images/M/MV5BMzk3MTE5MDU5NV5BMl5BanBnXkFtZTYwMjY3NTY3._V1_SX300.jpg,Columbia Pictures,PG-13,03 May 2002,True,121 min,Spider-Man,movie,http://spiderman.sonypictures.com/,"Stan Lee (Marvel comic book), Steve Ditko (Marvel comic book), David Koepp (screenplay)",2002,tt0145487,7.3,"562,630",certified,236
5,"Alexandre Rodrigues, Leandro Firmino, Phellipe Haagensen, Douglas Silva",Nominated for 4 Oscars. Another 65 wins & 37 nominations.,N/A,"Brazil, France",08 Jun 2004,"Fernando Meirelles, Kátia Lund","Crime, Drama",Portuguese,79,"Two boys growing up in a violent neighborhood of Rio de Janeiro take different paths: one becomes a photographer, the other a drug dealer.",https://images-na.ssl-images-amazon.com/images/M/MV5BMjA4ODQ3ODkzNV5BMl5BanBnXkFtZTYwOTc4NDI3._V1_SX300.jpg,Miramax Films,R,13 Feb 2004,True,130 min,City of God,movie,http://www.miramax.com/movie/city-of-god,"Paulo Lins (novel), Bráulio Mantovani (screenplay)",2002,tt0317248,8.7,"557,588",certified,156
6,"Daniel Radcliffe, Rupert Grint, Emma Watson, Richard Griffiths",Nominated for 3 BAFTA Film Awards. Another 11 wins & 40 nominations.,"$261,835,892.00","UK, USA, Germany",11 Apr 2003,Chris Columbus,"Adventure, Family, Fantasy",English,63,"Harry ignores warnings not to return to Hogwarts, only to find the school plagued by a series of mysterious attacks and a strange voice haunting him.",https://images-na.ssl-images-amazon.com/images/M/MV5BMTcxODgwMDkxNV5BMl5BanBnXkFtZTYwMDk2MDg3._V1_SX300.jpg,Warner Bros. Pictures,PG,15 Nov 2002,True,161 min,Harry Potter and the Chamber of Secrets,movie,http://harrypotter.warnerbros.com/,"J.K. Rowling (novel), Steve Kloves (screenplay)",2002,tt0295297,7.4,"410,363",certified,230
7,"Bruce Allpress, Sean Astin, John Bach, Sala Baker",Won 2 Oscars. Another 114 wins & 127 nominations.,"$339,700,000.00","USA, New Zealand",26 Aug 2003,Peter Jackson,"Adventure, Drama, Fantasy","English, Sindarin, Old English",88,"While Frodo and Sam edge closer to Mordor with the help of the shifty Gollum, the divided fellowship makes a stand against Sauron's new ally, Saruman, and his hordes of Isengard.",https://images-na.ssl-images-amazon.com/images/M/MV5BMTAyNDU0NjY4NTheQTJeQWpwZ15BbWU2MDk4MTY2Nw@@._V1_SX300.jpg,New Line Cinema,PG-13,18 Dec 2002,True,179 min,The Lord of the Rings: The Two Towers,movie,http://www.lordoftherings.net/,"J.R.R. Tolkien (novel), Fran Walsh (screenplay), Philippa Boyens (screenplay), Stephen Sinclair (screenplay), Peter Jackson (screenplay)",2002,tt0167261,8.7,"1,148,935",certified,248
8,"Ryan McCluskey, Oscar Pearce, Indra Ové, Anna Bolt",6 nominations.,"$39,532,308.00","UK, Germany, France, USA",30 Jul 2002,Paul W.S. Anderson,"Action, Horror, Sci-Fi",English,33,"A special military unit fights a powerful, out-of-control supercomputer and hundreds of scientists who have mutated into flesh-eating creatures after a laboratory accident.",https://images-na.ssl-images-amazon.com/images/M/MV5BN2Y2MTljNjMtMDRlNi00ZWNhLThmMWItYTlmZjYyZDk4NzYxXkEyXkFqcGdeQXVyNjQ2MjQ5NzM@._V1_SX300.jpg,Columbia Tristar Pictures,R,15 Mar 2002,True,100 min,Resident Evil,movie,http://www.spe.sony.com/movies/residentevil,Paul W.S. Anderson,2002,tt0120804,6.7,"205,614",rotten,124
9,"Taye Diggs, Cliff Saunders, Catherine Zeta-Jones, Renée Zellweger",Won 6 Oscars. Another 49 wins & 121 nominations.,N/A,"USA, Germany, Canada",19 Aug 2003,Rob Marshall,"Comedy, Crime, Musical","English, Hungarian",82,Murderesses Velma Kelly and Roxie Hart find themselves on death row together and fight for the fame that will keep them from the gallows in 1920s Chicago.,https://images-na.ssl-images-amazon.com/images/M/MV5BMTIyMTg1MzMzNl5BMl5BanBnXkFtZTYwMDU0NTk5._V1_SX300.jpg,Miramax Films,PG-13,24 Jan 2003,True,113 min,Chicago,movie,http://www.miramax.com/movie/chicago,"Bill Condon (screenplay), Bob Fosse (book), Fred Ebb (book), Maurine Dallas Watkins (play)",2002,tt0299658,7.2,"177,556",certified,244
10,"Adrien Brody, Emilia Fox, Michal Zebrowski, Ed Stoppard",Won 3 Oscars. Another 52 wins & 70 nominations.,"$32,519,322.00","France, Poland, Germany, UK",27 May 2003,Roman Polanski,"Biography, Drama, War","English, German, Russian",85,A Polish Jewish musician struggles to survive the destruction of the Warsaw ghetto of World War II.,https://images-na.ssl-images-amazon.com/images/M/MV5BOWRiZDIxZjktMTA1NC00MDQ2LWEzMjUtMTliZmY3NjQ3ODJiXkEyXkFqcGdeQXVyNjU0OTQ0OTY@._V1_SX300.jpg,Focus Features,R,28 Mar 2003,True,150 min,The Pianist,movie,http://www.thepianistmovie.com/,"Ronald Harwood (screenplay), Wladyslaw Szpilman (book)",2002,tt0253474,8.5,"529,364",certified,178
11,"Tom Cruise, Max von Sydow, Steve Harris, Neal McDonough",Nominated for 1 Oscar. Another 18 wins & 76 nominations.,"$132,000,000.00",USA,17 Dec 2002,Steven Spielberg,"Action, Mystery, Sci-Fi","English, Swedish",80,"In a future where a special police unit is able to arrest murderers before they commit their crimes, an officer from that unit is himself accused of a future murder.",https://images-na.ssl-images-amazon.com/images/M/MV5BMDgzNDk3ZDctYTUxMC00MDQzLWI1MTctMmQxYWE0MGUzYzIxXkEyXkFqcGdeQXVyNTIzOTk5ODM@._V1_SX300.jpg,Dreamworks,PG-13,21 Jun 2002,True,145 min,Minority Report,movie,http://www.minorityreport.com,"Philip K. Dick (short story), Scott Frank (screenplay), Jon Cohen (screenplay)",2002,tt0181689,7.7,"415,973",certified,245
12,"Alex Palmer, Bindu De Stoppani, Jukka Hiltunen, David Schneider",9 wins & 27 nominations.,"$44,900,469.00",UK,21 Oct 2003,Danny Boyle,"Drama, Horror, Sci-Fi","English, Spanish",73,"Four weeks after a mysterious, incurable virus spreads throughout the UK, a handful of survivors try to find sanctuary.",https://images-na.ssl-images-amazon.com/images/M/MV5BMTk3NjEwNDMzMF5BMl5BanBnXkFtZTgwMzgwNDgwNzE@._V1_SX300.jpg,Fox Searchlight Pictures,R,27 Jun 2003,True,113 min,28 Days Later...,movie,http://www.28dayslaterthemovie.co.uk/main.html,Alex Garland,2002,tt0289043,7.6,"307,445",certified,219
13,"Tommy Lee Jones, Will Smith, Rip Torn, Lara Flynn Boyle",4 wins & 12 nominations.,"$190,400,000.00",USA,26 Nov 2002,Barry Sonnenfeld,"Action, Adventure, Comedy",English,49,Agent J needs help so he is sent to find Agent K and restore his memory.,https://images-na.ssl-images-amazon.com/images/M/MV5BMTMxNDA0NTMxMV5BMl5BanBnXkFtZTYwMDE2NzY2._V1_SX300.jpg,Columbia Pictures,PG-13,03 Jul 2002,True,88 min,Men in Black II,movie,http://www.sonypictures.com/movies/meninblack/,"Lowell Cunningham (comic book ""Malibu Comics""), Robert Gordon (story), Robert Gordon (screenplay), Barry Fanaro (screenplay)",2002,tt0120912,6.1,"277,032",rotten,194
14,"Shane West, Mandy Moore, Peter Coyote, Daryl Hannah",4 wins & 2 nominations.,"$41,090,572.00",USA,09 Jul 2002,Adam Shankman,"Drama, Romance",English,35,"The story of two North Carolina teens, Landon Carter and Jamie Sullivan, who are thrown together after Landon gets into trouble and is made to do community service.",https://images-na.ssl-images-amazon.com/images/M/MV5BMzU3NTYxM2MtNjViMS00YmNlLWEwM2MtYWI2MzgzNTkxODFjXkEyXkFqcGdeQXVyMTQxNzMzNDI@._V1_SX300.jpg,Warner Bros. Pictures,PG,25 Jan 2002,True,101 min,A Walk to Remember,movie,http://awalktoremember.warnerbros.com,"Nicholas Sparks (novel), Karen Janszen (screenplay)",2002,tt0281358,7.4,"169,119",rotten,103
15,"Eminem, Kim Basinger, Mekhi Phifer, Brittany Murphy",Won 1 Oscar. Another 12 wins & 21 nominations.,"$116,638,030.00","USA, Germany",18 Mar 2003,Curtis Hanson,"Drama, Music",English,77,"A young rapper, struggling with every aspect of his life, wants to make it big but his friends and foes make this odyssey of rap harder than it may seem.",https://images-na.ssl-images-amazon.com/images/M/MV5BOWI3MDIzZmYtN2Y3MC00YTljLWFiYmYtNWIzMjg1ZWQ1ODlhXkEyXkFqcGdeQXVyNjU0OTQ0OTY@._V1_SX300.jpg,Universal Pictures,R,08 Nov 2002,True,110 min,8 Mile,movie,http://www.8-mile.com/,Scott Silver,2002,tt0298203,7.0,"196,318",certified,206
16,"Monica Bellucci, Vincent Cassel, Albert Dupontel, Jo Prestia",3 wins & 9 nominations.,"$573,018.00",France,05 Aug 2003,Gaspar Noé,"Crime, Drama, Mystery","French, Spanish, Italian, English",51,Events over the course of one traumatic night in Paris unfold in reverse-chronological order as the beautiful Alex is brutally raped and beaten by a stranger in the underpass.,https://images-na.ssl-images-amazon.com/images/M/MV5BMzcyNjcwNzg2Nl5BMl5BanBnXkFtZTYwNzA5Mzc2._V1_SX300.jpg,Mars Films,NOT RATED,22 May 2002,True,97 min,Irreversible,movie,http://www.irreversiblethemovie.com,Gaspar Noé,2002,tt0290673,7.4,"91,061",rotten,120
17,"Mel Gibson, Joaquin Phoenix, Rory Culkin, Abigail Breslin",3 wins & 30 nominations.,"$227,935,522.00",USA,07 Jan 2003,M. Night Shyamalan,"Drama, Mystery, Sci-Fi","English, Portuguese",59,A family living on a farm finds mysterious crop circles in their fields which suggests something more frightening to come.,https://images-na.ssl-images-amazon.com/images/M/MV5BNDUwMDUyMDAyNF5BMl5BanBnXkFtZTYwMDQ3NzM3._V1_SX300.jpg,Buena Vista Distribution Compa,PG-13,02 Aug 2002,True,106 min,Signs,movie,http://bventertainment.go.com/movies/signs/index.html,M. Night Shyamalan,2002,tt0286106,6.7,"279,433",certified,228
18,"Jim Caviezel, Guy Pearce, Richard Harris, James Frain",N/A,"$54,111,443.00","UK, USA, Ireland",10 Sep 2002,Kevin Reynolds,"Action, Adventure, Drama",English,61,"A young man, falsely imprisoned by his jealous ""friend,"" escapes and uses a hidden treasure to exact his revenge.",https://images-na.ssl-images-amazon.com/images/M/MV5BMDM0ZWRjZDgtZWI0MS00ZTIzLTg4MWYtZjU5MDEyMDU0ODBjXkEyXkFqcGdeQXVyMTQxNzMzNDI@._V1_SX300.jpg,Touchstone Pictures,PG-13,25 Jan 2002,True,131 min,The Count of Monte Cristo,movie,http://bventertainment.go.com/movies/montecristo,"Alexandre Dumas père (novel), Jay Wolpert (screenplay)",2002,tt0245844,7.7,"107,999",fresh,143
19,"James Spader, Maggie Gyllenhaal, Jeremy Davies, Lesley Ann Warren",Nominated for 1 Golden Globe. Another 15 wins & 25 nominations.,"$3,806,471.00",USA,01 Apr 2003,Steven Shainberg,"Comedy, Drama, Romance",English,63,"A young woman, recently released from a mental hospital, gets a job as a secretary to a demanding lawyer, where their employer-employee relationship turns into a sexual, sadomasochistic one.",https://images-na.ssl-images-amazon.com/images/M/MV5BMjA5ODIzMTQ4M15BMl5BanBnXkFtZTYwMDgwNDA3._V1_SX300.jpg,Lions Gate,R,11 Oct 2002,True,104 min,Secretary,movie,http://www.secretarythemovie.com/,"Erin Cressida Wilson (screenplay), Mary Gaitskill (short story), Steven Shainberg (story adaptation), Erin Cressida Wilson (story adaptation)",2002,tt0274812,7.1,"70,178",certified,146
20,"Vin Diesel, Asia Argento, Marton Csokas, Samuel L. Jackson",4 wins & 13 nominations.,"$141,134,092.00",USA,31 Dec 2002,Rob Cohen,"Action, Adventure, Thriller","English, German, Spanish, Russian, Czech",48,"An extreme sports athlete, Xander Cage, is recruited by the government on a special mission.",https://images-na.ssl-images-amazon.com/images/M/MV5BNzZjZmM1ZDctNDhlZi00Mzk1LWFjNWItYzIxNGY2OWYzYjJmXkEyXkFqcGdeQXVyNjQ2MjQ5NzM@._V1_SX300.jpg,Columbia Pictures,PG-13,09 Aug 2002,True,124 min,xXx,movie,http://www.sonypictures.com/movies/triplex/,Rich Wilkes,2002,tt0295701,5.8,"149,273",rotten,178
21,"Sandra Bullock, Hugh Grant, Alicia Witt, Dana Ivey",2 wins & 3 nominations.,"$93,300,000.00","USA, Australia",29 Apr 2003,Marc Lawrence,"Comedy, Romance",English,42,"A lawyer decides that she's used too much like a nanny by her boss, so she walks out on him.",https://images-na.ssl-images-amazon.com/images/M/MV5BMTk2MTYzNTk5Nl5BMl5BanBnXkFtZTYwMTUyMzE3._V1_SX300.jpg,Warner Bros.,PG-13,20 Dec 2002,True,101 min,Two Weeks Notice,movie,http://twoweeksnoticemovie.warnerbros.com,Marc Lawrence,2002,tt0313737,6.1,"88,622",rotten,121
22,"Ewan McGregor, Natalie Portman, Hayden Christensen, Christopher Lee",Nominated for 1 Oscar. Another 16 wins & 53 nominations.,"$307,900,000.00",USA,12 Nov 2002,George Lucas,"Action, Adventure, Fantasy",English,54,"Ten years after initially meeting, Anakin Skywalker shares a forbidden romance with Padmé, while Obi-Wan investigates an assassination attempt on the Senator and discovers a secret clone army crafted for the Jedi.",https://images-na.ssl-images-amazon.com/images/M/MV5BNDRkYzA4OGYtOTBjYy00YzFiLThhYmYtMWUzMDBmMmZkM2M3XkEyXkFqcGdeQXVyNDYyMDk5MTU@._V1_SX300.jpg,20th Century Fox,PG,16 May 2002,True,142 min,Star Wars: Episode II - Attack of the Clones,movie,http://www.starwars.com/episode-ii/,"George Lucas (screenplay), Jonathan Hales (screenplay), George Lucas (story by)",2002,tt0121765,6.7,"487,639",fresh,244
23,"Matt Damon, Franka Potente, Chris Cooper, Clive Owen",3 wins & 5 nominations.,"$121,500,000.00","USA, Germany, Czech Republic",21 Jan 2003,Doug Liman,"Action, Mystery, Thriller","English, French, German, Dutch, Italian",68,"A man is picked up by a fishing boat, bullet-riddled and suffering from amnesia, before racing to elude assassins and regain his memory.",https://images-na.ssl-images-amazon.com/images/M/MV5BM2JkNGU0ZGMtZjVjNS00NjgyLWEyOWYtZmRmZGQyN2IxZjA2XkEyXkFqcGdeQXVyNTIzOTk5ODM@._V1_SX300.jpg,Universal Pictures,PG-13,14 Jun 2002,True,119 min,The Bourne Identity,movie,http://www.thebourneidentity.com/,"Tony Gilroy (screenplay), W. Blake Herron (screenplay), Robert Ludlum (novel)",2002,tt0258463,7.9,"425,184",certified,186
24,"Jodie Foster, Kristen Stewart, Forest Whitaker, Dwight Yoakam",1 win & 9 nominations.,"$95,308,367.00",USA,17 Sep 2002,David Fincher,"Crime, Drama, Thriller",English,65,"A divorced woman and her diabetic daughter take refuge in their newly-purchased house's safe room, when three men break-in, searching for a missing fortune.",https://images-na.ssl-images-amazon.com/images/M/MV5BNmY4ZGFjYTYtMDNmYi00ZDM4LWFjYTgtNmNlZjBmMzg0MzQ3XkEyXkFqcGdeQXVyNDk3NzU2MTQ@._V1_SX300.jpg,Sony Pictures,R,29 Mar 2002,True,112 min,Panic Room,movie,http://www.spe.sony.com/movies/panicroom,David Koepp,2002,tt0258000,6.8,"213,508",certified,182
25,"Freddie Prinze Jr., Sarah Michelle Gellar, Matthew Lillard, Linda Cardellini",3 wins & 8 nominations.,"$153,300,000.00","USA, Australia",08 Oct 2002,Raja Gosnell,"Adventure, Comedy, Family",English,35,"After an acrimonious break up, the Mystery Inc. gang are individually brought to an island resort to investigate strange goings on.",https://images-na.ssl-images-amazon.com/images/M/MV5BMTg4MzMzMTY0OF5BMl5BanBnXkFtZTYwNzM3MTg2._V1_SX300.jpg,Warner Bros. Pictures,PG,14 Jun 2002,True,86 min,Scooby-Doo,movie,http://promo.warnerbros.com/scoobydoo/home.html,"James Gunn (screenplay), Craig Titley (story), James Gunn (story), William Hanna (characters), Joseph Barbera (characters)",2002,tt0267913,4.9,"74,273",rotten,143
26,"Mel Gibson, Madeleine Stowe, Greg Kinnear, Sam Elliott",2 wins & 5 nominations.,"$78,064,284.00","USA, Germany",20 Aug 2002,Randall Wallace,"Action, Drama, History","English, Vietnamese, French",65,The story of the first major battle of the American phase of the Vietnam War and the soldiers on both sides that fought it.,https://images-na.ssl-images-amazon.com/images/M/MV5BMDdmN2VmNmYtOGExNC00MmE4LTliOTUtOGMzMzFhMTNlOTM1L2ltYWdlXkEyXkFqcGdeQXVyMTQxNzMzNDI@._V1_SX300.jpg,Paramount Pictures,R,01 Mar 2002,True,138 min,We Were Soldiers,movie,http://www.weweresoldiers.com,"Harold G. Moore (book), Joseph L. Galloway (book), Randall Wallace (screenplay)",2002,tt0277434,7.1,"107,019",fresh,144
27,"Al Pacino, Martin Donovan, Oliver 'Ole' Zemen, Hilary Swank",1 win & 10 nominations.,"$67,300,000.00","USA, Canada",15 Oct 2002,Christopher Nolan,"Drama, Mystery, Thriller",English,78,Two Los Angeles homicide detectives are dispatched to a northern town where the sun doesn't set to investigate the methodical murder of a local teen.,https://images-na.ssl-images-amazon.com/images/M/MV5BYzlkZTEyYjUtMTY5NS00ZjU0LTk5OTYtM2M0ZDg1NmNjMzhkXkEyXkFqcGdeQXVyMTQxNzMzNDI@._V1_SX300.jpg,Warner Bros. Pictures,R,24 May 2002,True,118 min,Insomnia,movie,http://insomniamovie.warnerbros.com,"Hillary Seitz (screenplay), Nikolaj Frobenius, Erik Skjoldbjærg",2002,tt0278504,7.2,"226,342",certified,200
28,"Rob Schneider, Anna Faris, Matthew Lawrence, Eric Christian Olsen",4 nominations.,N/A,USA,25 Jan 2005,Tom Brady,"Comedy, Fantasy",English,29,"An attractive and popular teenager who is mean-spirited toward others finds herself in the body of an older man, and must find a way to get back to her original body.",https://images-na.ssl-images-amazon.com/images/M/MV5BMzY1NTAzNTA3Ml5BMl5BanBnXkFtZTYwMDA5Mzc3._V1_SX300.jpg,Buena Vista Distribution Compa,PG-13,13 Dec 2002,True,104 min,The Hot Chick,movie,http://touchstonepictures.go.com/hotchick/index.html?CMP=IL10283,"Tom Brady, Rob Schneider",2002,tt0302640,5.5,"76,629",rotten,83
29,"Anthony Hopkins, Edward Norton, Ralph Fiennes, Harvey Keitel",4 wins & 10 nominations.,"$92,930,005.00","Germany, USA",01 Apr 2003,Brett Ratner,"Crime, Drama, Thriller","English, French",60,"A retired FBI agent with psychological gifts is assigned to help track down ""The Tooth Fairy"", a mysterious serial killer; aiding him is imprisoned criminal genius Hannibal ""The Cannibal"" Lecter.",https://images-na.ssl-images-amazon.com/images/M/MV5BMTQ4MDgzNjM5MF5BMl5BanBnXkFtZTYwMjUwMzY2._V1_SX300.jpg,Universal Pictures,R,04 Oct 2002,True,124 min,Red Dragon,movie,http://www.reddragonmovie.com/,"Thomas Harris (novel), Ted Tally (screenplay)",2002,tt0289765,7.2,"209,324",fresh,185
30,"Pierce Brosnan, Halle Berry, Toby Stephens, Rosamund Pike",Nominated for 1 Golden Globe. Another 6 wins & 34 nominations.,"$160,201,106.00","UK, USA",03 Jun 2003,Lee Tamahori,"Action, Adventure, Thriller","English, Korean, Cantonese, Spanish, German, Icelandic, Italian",56,James Bond is sent to investigate the connection between a North Korean terrorist and a diamond mogul who is funding the development of an international space weapon.,https://images-na.ssl-images-amazon.com/images/M/MV5BODNkYmIwYTMtYzdhNy00YWE3LThkYmEtNzA5ZTE5YmVjYzZlXkEyXkFqcGdeQXVyNTIzOTk5ODM@._V1_SX300.jpg,MGM Pictures,PG-13,22 Nov 2002,True,133 min,Die Another Day,movie,http://www.jamesbond.com/,"Ian Fleming (characters), Neal Purvis, Robert Wade",2002,tt0246460,6.1,"174,376",rotten,215
31,"Reese Witherspoon, Josh Lucas, Patrick Dempsey, Candice Bergen",3 wins & 6 nominations.,"$127,214,072.00",USA,04 Feb 2003,Andy Tennant,"Comedy, Romance",English,45,"A young woman who's reinvented herself as a New York socialite must return home to Alabama to obtain a divorce from her husband, after seven years of separation.",https://images-na.ssl-images-amazon.com/images/M/MV5BMjEwMjIwMDQ4OV5BMl5BanBnXkFtZTYwNzc3OTY3._V1_SX300.jpg,Buena Vista Distribution Compa,PG-13,27 Sep 2002,True,108 min,Sweet Home Alabama,movie,http://www.sweet-home-alabama.com/,"Douglas J. Eboch (story), C. Jay Cox (screenplay)",2002,tt0256415,6.2,"86,345",rotten,157
32,"Parminder Nagra, Keira Knightley, Jonathan Rhys Meyers, Anupam Kher",Nominated for 1 Golden Globe. Another 17 wins & 19 nominations.,"$32,441,165.00","UK, Germany, USA",30 Sep 2003,Gurinder Chadha,"Comedy, Drama, Romance","English, Panjabi, Hindi, German",66,The daughter of orthodox Sikh rebels against her parents' traditionalism and joins a football team.,https://images-na.ssl-images-amazon.com/images/M/MV5BMTg1Njk5NjczM15BMl5BanBnXkFtZTYwNjc2NTQ3._V1_SX300.jpg,Fox Searchlight Pictures,PG-13,01 Aug 2003,True,112 min,Bend It Like Beckham,movie,http://www.foxsearchlight.com/benditlikebeckham,"Gurinder Chadha, Guljit Bindra, Paul Mayeda Berges",2002,tt0286499,6.7,"91,812",certified,150
33,"Diane Lane, Erik Per Sullivan, Richard Gere, Olivier Martinez",Nominated for 1 Oscar. Another 3 wins & 13 nominations.,"$52,655,427.00","USA, Germany, France",17 Dec 2002,Adrian Lyne,"Drama, Thriller","English, French",63,A New York suburban couple's marriage goes dangerously awry when the wife indulges in an adulterous fling.,https://images-na.ssl-images-amazon.com/images/M/MV5BYTQzZTE2N2QtM2QwMS00ZjUwLTg4ZDEtYjJiOTMwZjYxODJlXkEyXkFqcGdeQXVyMTQxNzMzNDI@._V1_SX300.jpg,20th Century Fox,R,10 May 2002,True,124 min,Unfaithful,movie,http://www.unfaithfulmovie.com,"Claude Chabrol (film ""La Femme infidèle""), Alvin Sargent (screenplay), William Broyles Jr. (screenplay)",2002,tt0250797,6.7,"65,048",rotten,161
34,"Yuet Sang Chin, Doo Hee Jang, Ho Kon Kim, Eddy Ko",N/A,N/A,Hong Kong,27 Jun 2000,John Woo,"Action, Drama, War","Cantonese, English, Thai, Vietnamese",N/A,"The Thai government hires a group of Chinese mercenaries to capture a powerful drug lord from the Golden Triangle. The mercenaries manage to capture the drug lord, but soon find themselves ...",https://images-na.ssl-images-amazon.com/images/M/MV5BMTI5MzA0MDI5OV5BMl5BanBnXkFtZTcwNDYzMTMyMQ@@._V1_SX300.jpg,Paragon Films,N/A,05 Sep 1986,True,82 min,Ying xiong wu lei,movie,N/A,John Woo,1986,tt0092264,6.2,792,N/A,N/A
35,"Daveigh Chase, Chris Sanders, Tia Carrere, David Ogden Stiers",Nominated for 1 Oscar. Another 10 wins & 27 nominations.,"$145,771,527.00",USA,03 Dec 2002,"Dean DeBlois, Chris Sanders","Animation, Adventure, Comedy","English, Hawaiian",73,A Hawaiian girl adopts an unusual pet who is actually a notorious extra-terrestrial fugitive from the law.,https://images-na.ssl-images-amazon.com/images/M/MV5BMTkwOTU5MTA2M15BMl5BanBnXkFtZTYwMjYyNTc3._V1_SX300.jpg,Buena Vista Distribution Compa,PG,21 Jun 2002,True,85 min,Lilo & Stitch,movie,http://disney.go.com/disneypictures/liloandstitch,"Chris Sanders (idea), Chris Sanders, Dean DeBlois",2002,tt0275847,7.2,"124,118",certified,145
36,"Nicole Kidman, Julianne Moore, Meryl Streep, Stephen Dillane",Won 1 Oscar. Another 41 wins & 121 nominations.,"$41,465,765.00","USA, UK",24 Jun 2003,Stephen Daldry,"Drama, Romance",English,81,"The story of how the novel ""Mrs. Dalloway"" affects three generations of women, all of whom, in one way or another, have had to deal with suicide in their lives.",https://images-na.ssl-images-amazon.com/images/M/MV5BMTY4MDQyNjM2OF5BMl5BanBnXkFtZTcwMjQxOTAzMw@@._V1_SX300.jpg,Miramax Films,PG-13,14 Feb 2003,True,114 min,The Hours,movie,http://www.thehoursmovie.com/home.php,"Michael Cunningham (novel), David Hare (screenplay)",2002,tt0274558,7.6,"104,886",certified,187
